{
  "$schema": "http://json-schema.org/draft-07/schema#",
  "$id": "https://catch.app/contracts/firestore/event_success_plans.schema.json",
  "title": "EventSuccessPlanDocument",
  "description": "Host-owned live event-success setup stored at eventSuccessPlans/{eventId}. The event id is the document id and is also stored for cheap validation and reads.",
  "type": "object",
  "additionalProperties": false,
  "x-firestore-collection": "eventSuccessPlans",
  "x-firestore-path": "eventSuccessPlans/{eventId}",
  "x-document-id-field": "id",
  "x-owner": "organizer manager direct write; event participants read",
  "x-internal-demo-fields": [
    "synthetic",
    "seedPrefix",
    "scenario",
    "demoOps",
    "demoOpsId",
    "demoOpsCommand"
  ],
  "required": [
    "eventId",
    "organizerId",
    "playbookId",
    "selectedModuleIds",
    "targetAttendeeCount",
    "hostGoal",
    "wingmanRequestsEnabled",
    "contextualOpenersEnabled",
    "activeStepIndex",
    "status",
    "createdAt",
    "updatedAt"
  ],
  "properties": {
    "eventId": {
      "$ref": "../shared/event_common.schema.json#/definitions/documentId",
      "x-catch-ownership": "callable-owned"
    },
    "organizerId": {
      "$ref": "../shared/event_common.schema.json#/definitions/documentId",
      "x-catch-ownership": "callable-owned"
    },
    "layoutId": {
      "type": ["string", "null"],
      "pattern": "^[A-Za-z0-9][A-Za-z0-9_-]{0,119}$",
      "x-catch-ownership": "callable-owned"
    },
    "affinityConstraints": {
      "type": "array",
      "maxItems": 300,
      "items": {
        "$ref": "../shared/event_success_layout.schema.json#/definitions/affinityConstraint"
      },
      "x-catch-ownership": "callable-owned"
    },
    "spatialOverrides": {
      "type": "array",
      "maxItems": 300,
      "items": {
        "$ref": "../shared/event_success_layout.schema.json#/definitions/spatialOverride"
      },
      "x-catch-ownership": "callable-owned"
    },
    "playbookId": {
      "type": "string",
      "minLength": 1,
      "maxLength": 120,
      "x-catch-ownership": "callable-owned"
    },
    "selectedModuleIds": {
      "type": "array",
      "maxItems": 24,
      "items": {
        "type": "string",
        "minLength": 1,
        "maxLength": 120
      },
      "x-catch-ownership": "callable-owned"
    },
    "targetAttendeeCount": {
      "type": "integer",
      "minimum": 1,
      "maximum": 1000,
      "x-catch-ownership": "callable-owned"
    },
    "structureConfig": {
      "$ref": "../shared/event_common.schema.json#/definitions/eventSuccessStructureConfig",
      "x-catch-ownership": "callable-owned"
    },
    "assignmentFeatureRules": {
      "type": "array",
      "maxItems": 8,
      "items": {"$ref": "../shared/assignment_feature_common.schema.json#/definitions/featureRule"},
      "x-catch-ownership": "callable-owned"
    },
    "assignmentFeatureRevision": {
      "type": "integer", "minimum": 0, "maximum": 9007199254740991,
      "x-catch-ownership": "callable-owned"
    },
    "assignmentFeatureRequestId": {
      "$ref": "../shared/event_common.schema.json#/definitions/documentId",
      "x-catch-ownership": "callable-owned"
    },
    "assignmentFeatureConfigHash": {
      "type": "string", "pattern": "^[a-f0-9]{64}$",
      "x-catch-ownership": "callable-owned"
    },
    "hostGoal": {
      "type": "string",
      "maxLength": 300,
      "x-catch-ownership": "callable-owned"
    },
    "wingmanRequestsEnabled": {
      "type": "boolean",
      "x-catch-ownership": "callable-owned"
    },
    "contextualOpenersEnabled": {
      "type": "boolean",
      "x-catch-ownership": "callable-owned"
    },
    "compatibilityAffectsRanking": {
      "type": "boolean",
      "x-catch-ownership": "callable-owned"
    },
    "questionnaireConfig": {
      "$ref": "../shared/event_common.schema.json#/definitions/eventSuccessQuestionnaireConfig",
      "x-catch-ownership": "callable-owned"
    },
    "conversationGraphConsentMode": {
      "type": "string",
      "enum": [
        "optIn",
        "optOut"
      ],
      "description": "Whether assigned attendees begin unselected or preselected in the end-of-event conversation graph. Missing legacy values resolve to optIn.",
      "x-catch-ownership": "callable-owned"
    },
    "activeStepIndex": {
      "type": "integer",
      "minimum": 0,
      "maximum": 100,
      "x-catch-ownership": "callable-owned"
    },
    "liveControlRevision": {
      "type": "integer",
      "minimum": 0,
      "maximum": 2147483647,
      "x-catch-ownership": "callable-owned"
    },
    "assignmentDraftRevision": {
      "type": "integer",
      "minimum": 0,
      "maximum": 2147483647,
      "x-catch-ownership": "callable-owned"
    },
    "publishedRotationRoundIndex": {
      "type": "integer",
      "minimum": -1,
      "maximum": 100,
      "x-catch-ownership": "callable-owned"
    },
    "publishedRevealRoundIndex": {
      "type": "integer",
      "minimum": -1,
      "maximum": 100,
      "x-catch-ownership": "callable-owned"
    },
    "status": {
      "type": "string",
      "enum": [
        "setup",
        "live",
        "complete"
      ],
      "x-catch-ownership": "callable-owned"
    },
    "revealStatus": {
      "type": "string",
      "enum": [
        "idle",
        "countingDown",
        "revealed"
      ],
      "x-catch-ownership": "callable-owned"
    },
    "activeRevealRoundIndex": {
      "type": "integer",
      "minimum": 0,
      "maximum": 100,
      "x-catch-ownership": "callable-owned"
    },
    "revealStartedAt": {
      "$ref": "../shared/event_common.schema.json#/definitions/nullableTimestamp",
      "x-catch-ownership": "callable-owned"
    },
    "attendeePrompt": {
      "type": [
        "string",
        "null"
      ],
      "maxLength": 300,
      "x-catch-ownership": "callable-owned"
    },
    "createdAt": {
      "$ref": "../shared/event_common.schema.json#/definitions/timestamp",
      "x-catch-ownership": "callable-owned"
    },
    "updatedAt": {
      "$ref": "../shared/event_common.schema.json#/definitions/timestamp",
      "x-catch-ownership": "callable-owned"
    },
    "frozenAt": {
      "$ref": "../shared/event_common.schema.json#/definitions/nullableTimestamp",
      "x-catch-ownership": "callable-owned"
    },
    "completedAt": {
      "$ref": "../shared/event_common.schema.json#/definitions/nullableTimestamp",
      "x-catch-ownership": "callable-owned"
    },
    "synthetic": {
      "$ref": "../shared/event_common.schema.json#/definitions/demoMetadataFields/synthetic"
    },
    "seedPrefix": {
      "$ref": "../shared/event_common.schema.json#/definitions/demoMetadataFields/seedPrefix"
    },
    "scenario": {
      "$ref": "../shared/event_common.schema.json#/definitions/demoMetadataFields/scenario"
    },
    "demoOps": {
      "$ref": "../shared/event_common.schema.json#/definitions/demoMetadataFields/demoOps"
    },
    "demoOpsId": {
      "$ref": "../shared/event_common.schema.json#/definitions/demoMetadataFields/demoOpsId"
    },
    "demoOpsCommand": {
      "$ref": "../shared/event_common.schema.json#/definitions/demoMetadataFields/demoOpsCommand"
    }
  }
}
