{
  "eventId": "event-1",
  "organizerId": "club-1",
  "playbookId": "algorithmic_mixer_reveal",
  "selectedModuleIds": [
    "qr_check_in",
    "guided_rotations",
    "live_reveal",
    "compatibility_questionnaire",
    "wingman_requests",
    "decomposed_feedback",
    "host_analytics"
  ],
  "targetAttendeeCount": 24,
  "structureConfig": {
    "unitKind": "pairs",
    "unitSize": 2,
    "rotationIntervalMinutes": 15,
    "revealCountdownSeconds": 15
  },
  "hostGoal": "Help everyone meet a few new people without awkward logistics.",
  "wingmanRequestsEnabled": true,
  "contextualOpenersEnabled": true,
  "compatibilityAffectsRanking": true,
  "questionnaireConfig": {
    "templateId": "balanced"
  },
  "conversationGraphConsentMode": "optIn",
  "activeStepIndex": 0,
  "status": "setup",
  "revealStatus": "idle",
  "activeRevealRoundIndex": 0,
  "attendeePrompt": "Ask what brought them here tonight.",
  "createdAt": {"_seconds": 1777615000, "_nanoseconds": 0},
  "updatedAt": {"_seconds": 1777615060, "_nanoseconds": 0}
}
